{
  "schemaVersion": "1.0",
  "requestId": "trace-1",
  "snapshot": {
    "snapshotId": "snap-1",
    "source": "admin/group-stats",
    "observedAt": "2026-07-17T02:00:00Z",
    "expiresAt": "2026-07-17T02:05:00Z",
    "contentHash": "sha256:ecbef1fa10df7cd02d9ae2b5905a2a70a0adf4eea5524db58d74ddcd8d0a64fb"
  },
  "data": {
    "gid": "g1",
    "pv": 100,
    "uv": 80,
    "uip": 60
  },
  "warnings": []
}
